{
  "$schema": "./training.schema.json",
  "id": "beispiel-training",
  "name": "Beispiel-Training",
  "version": "1.0.0",
  "description": "Minimales Beispiel zur Demonstration der Import-Funktion",
  "questions": [
    {
      "type": "text",
      "question": "Wie lautet die Antwort auf diese Beispielfrage?",
      "answer": ["Beispiel", "beispiel"]
    },
    {
      "type": "multiple-choice",
      "question": "Welche Farbe hat der Himmel bei klarem Wetter?",
      "options": [
        { "text": "Blau", "correct": true, "explanation": "Richtig! Der Himmel erscheint blau durch die Streuung des Lichts." },
        { "text": "Grün", "correct": false, "explanation": "Nein, der Himmel ist nicht grün." },
        { "text": "Rot", "correct": false, "explanation": "Rot erscheint der Himmel nur bei Sonnenauf- oder -untergang." }
      ]
    },
    {
      "type": "true-false",
      "question": "Bewerte die folgende Aussage:",
      "statement": "Dies ist ein Beispiel-Training zum Testen der Import-Funktion.",
      "correct": true,
      "explanation": "Richtig! Dies ist tatsächlich ein Beispiel-Training."
    }
  ]
}
